,id,name,cluster,host_id,host,host_alias,alias_id,listing_url,host_url,minimum_minimum_nights,license,ISD_status,ISD_address,neighborhood_overview,description,last_scraped
1451,40227108,Savin Hill Cozy ( B),120-2,310681680,Frank,,,https://www.airbnb.com/rooms/40227108,https://www.airbnb.com/users/show/310681680,1.0,413138,Active,16 Hubbardston RD 13 2 Dorchester MA 02125,,"My house is at Savin Hill. It is very convenient for traveling. Walking one minute to redline subway station Savin Hill, nearby UMASS Boston and castle island beach, it situated at the center in the city, it is convenient to everywhere in Boston by public transportation. We highly recommend you to stay here for your tour in Boston. We are very nice , friendly and helpful to you！<br /><br /><b>License number</b><br />STR-413138",2020-09-01
1452,40252561,Savin Hill Cozy (C),120-2,310681680,Frank,,,https://www.airbnb.com/rooms/40252561,https://www.airbnb.com/users/show/310681680,1.0,413138,Active,16 Hubbardston RD 13 2 Dorchester MA 02125,,"The house is located on Savin Hill. It’s minutes to get to Downtown Boston, Harvard university and MIT.<br /><br />Two minutes walking to redline subway station, very convenient.<br /><br /><b>License number</b><br />STR-413138",2020-09-01
1463,40376946,Savin hill cozy(A),120-2,310681680,Frank,,,https://www.airbnb.com/rooms/40376946,https://www.airbnb.com/users/show/310681680,1.0,413138,Active,16 Hubbardston RD 13 2 Dorchester MA 02125,,My house located Savin hill station. Perfect for you to explore Boston.<br /><br /><b>License number</b><br />STR-413138,2020-09-01
1471,40485312,No3,120-3,310681680,Frank,,,https://www.airbnb.com/rooms/40485312,https://www.airbnb.com/users/show/310681680,1.0,314137,?,,,<b>License number</b><br />STR-314137,2020-09-01
1472,40485818,Downtown Boston/UMASS/Lovely Private Room(4),120-1,310681680,Frank,,,https://www.airbnb.com/rooms/40485818,https://www.airbnb.com/users/show/310681680,1.0,413137,Active,16 Hubbardston RD 13 1 Dorchester MA 02125,,"One minute walking distance to subway station. Will take you to Downtown Boston in 15 minutes,20 minutes to Harvard and MIT. Hot area. Very convenient!<br /><br /><b>License number</b><br />STR-413137",2020-09-01
1473,40485953,Savin Hill private bedroom/Downtown Boston/UMASS(5,120-1,310681680,Frank,,,https://www.airbnb.com/rooms/40485953,https://www.airbnb.com/users/show/310681680,1.0,413137,Active,16 Hubbardston RD 13 1 Dorchester MA 02125,,"My house is very close Savin Hill station. It’s good choice, if you like to visit Boston by subway<br /><br /><b>License number</b><br />STR-413137",2020-09-01
1474,40486057,Cozy Boston Bedroom (6),120-1,310681680,Frank,,,https://www.airbnb.com/rooms/40486057,https://www.airbnb.com/users/show/310681680,1.0,413137,Active,16 Hubbardston RD 13 1 Dorchester MA 02125,,Come visit Boston and stay at this unique bedroom in the Savin hill. Perfect for you to explore Boston.<br /><br /><b>License number</b><br />STR-413137,2020-09-01
