,id,name,cluster,host_id,host,host_alias,alias_id,listing_url,host_url,minimum_minimum_nights,license,ISD_status,ISD_address,neighborhood_overview,description,last_scraped
0,5506,**$49 Special **   Private! Minutes to center!,128-1,8229,Terry,,,https://www.airbnb.com/rooms/5506,https://www.airbnb.com/users/show/8229,3.0,Exemption: hospital contracts,?,,"Peacful, Architecturally interesting, historic, diverse, and quiet residential. <br /><br />Racially, culturally,  ethnically, and economically diverse.","Private guest room with private bath, You do not need to cut through anyone else's space to get to guest room. No shared space.  Private entrance off main hall/stairs of the building.   Has a mini fridge, micro and coffee maker.<br /><br /><b>The space</b><br />**THE BEST Value in BOSTON!!*** PRIVATE GUEST ROOM WITH PRIVATE BATH.<br /><br />$49 special!!!!  all remaining nights this month! 3 night minimum. Ask for the monthly special. (Taxes, fees for cleaning and airbnb site fees  are additional and not included)<br /><br /><br />**Super Value on a Really Nice, Comfortable, Tastefully decorated guest room, Clean, w/ full private bath available for your long or short term stay! Why stay in an overpriced hotel???!! <br /><br /><br />**Excellent Boston location, a 5 minute walk to the Orange Line Train, 4 Minute ride to Copley Plaza, the Center of all Boston attractions! Back Bay/South End, Downtown. <br /><br /><br />**Located in a quiet Boston residential neighborhood, In a Historic Bo",2020-08-31
1,6695,$99 Special!! Home Away! Condo,128-4,8229,Terry,,,https://www.airbnb.com/rooms/6695,https://www.airbnb.com/users/show/8229,3.0,404620,Expired,3 Centre PL 11 Apt 2 Roxbury MA 02119,"Peaceful, Architecturally interesting, historic, diverse, and quiet. Racially, culturally,  ethnic, and economically diverse.","Comfortable,  Fully Equipped private apartment on 2 levels.  Sleeps up to 4.  Sleeper sofa in living room Steps inside unit to bedroom.<br /><br /><b>The space</b><br />** WELCOME *** FULL PRIVATE APARTMENT In a Historic Victorian Brick Row House, Circa 1860. <br /><br />**EXCELLENT SUNNY!! ***HOME AWAY!**.  SPECIAL!! ***All Remaining Nights this Month!!! $99 nt, Special is for up to 2 guests, (Taxes, fees for cleaning and airbnb site fees  are additional and not included) 3 night minimum.. Perfect for Vacation and Extended Stays! Ask for this months promotion! Does not include holidays and special events. <br />Super value on a very nice, comfortable, tastefully decorated, clean, private 1 Bedroom Duplex Condo/Apartment with full kitchen and full bath available for your long or short term stay! <br /><br />Excellent Boston location, 5 minute walk to the Orange Line Train, 4 Minute ride to the Center of all Boston attractions! 3 short stops(1.5miles) to Copley Plaza/Back Bay/South End,",2020-08-31
11,163941,$99* SPECIAL* 2 bed ApT! Location!,128-1,8229,Terry,,,https://www.airbnb.com/rooms/163941,https://www.airbnb.com/users/show/8229,3.0,Exemption: hospital contracts,?,,"Peaceful, Architecturally interesting, historic, diverse, and quiet. Racially, culturally, ethnic, and economically diverse.","**Excellent Sunny** Fully equipped Private Duplex Apartment!   Walking distance to Museums, Northeastern U and Hospitals.  1.5 miles to the center of the attractions.  1-2 miles to Fenway Park.  Perfect Boston Home Base!  Accommodates up to 6 guests!<br /><br /><b>The space</b><br />Welcome to the Fort Hill Inn in Boston MA!  Super value on a very nice, comfortable, tastefully decorated, clean, private 2 bedroom Duplex apartment.  <br /><br />*Monthly Special!  All remaining nights this month $99, includes up to 2 guests. (Taxes, fees for cleaning and airbnb site fees  are additional and not included)  Ask for the ""monthly special!!""  <br /><br />Excellent Boston location,  5 minute walk to the Orange Line train, 4 minute ride to the center of all Boston attractions.    3 short stops (1.5 miles) to Copley Plaza/Back Bay/South End, Downtown.  Walk to Museums from here.   We are in the geographical center of Boston.<br /><br />Located in the quiet Boston residential neighborhood of Fort ",2020-08-31
26,801680,*$89 Special!  BOSTONS BEST!!* Minutes to Center*,128-1,8229,Terry,,,https://www.airbnb.com/rooms/801680,https://www.airbnb.com/users/show/8229,3.0,Exemption: hospital contracts,?,,"Architecturally interesting, historic, diverse, and quiet residential neighborhood. Racially, culturally, ethnically, and economically diverse.<br /><br />Restaurants,  Full service market,  beer Wine Store are all within a 15-20 minute walk from the apartment","Excellent Sunny Private Apartment in a Historic Victorian Row House.  Minutes to the city center and attractions.<br /><br /><b>The space</b><br />** WELCOME *** FULL PRIVATE APARTMENT In a Historic Victorian Brick Row House, Circa 1860.<br /><br />**EXCELLENT SUNNY!! ***Full Private Apartment!**. SPECIAL!! ***All remaining Nights this month $89 per night (Taxes, fees for cleaning and airbnb site fees are additional and not included), 3 night minimum.. *5 night minimum marathon week*  (no discount available) Perfect for Vacation and Extended Stays! Ask for this months promotion!<br /><br />Super value on a very nice, comfortable, tastefully decorated, clean, private 1 Bedroom Apartment with full kitchen and full bath available for your long or short term stay!<br /><br />Excellent Boston location, 5 minute walk to the Orange Line Train, 4 Minute ride to the Center of Boston attractions! 3 short stops(1.5miles) to Copley Plaza/Back Bay/South End, Downtown. Walk to Museums from here. We ",2020-08-31
27,801722,$79 Special!!  Minutes to Center!  Private Space,128-3,8229,Terry,,,https://www.airbnb.com/rooms/801722,https://www.airbnb.com/users/show/8229,3.0,404619,Expired,3 Centre PL 11 Apt 3 Roxbury MA 02119,"Peaceful, Cool Architecture, historic, diverse, and quiet neighborhood. Racially, culturally,  ethnically, and economically diverse.","Comfortable private guest room with private bath available for you long or short term stay.   This listing does not have any shared spaces.   You enter from the main hall stairs of the building and do not pass through anyone else's living space.<br /><br /><b>The space</b><br />** BEST Value in BOSTON!!*** PRIVATE GUEST ROOM WITH PRIVATE BATH.<br /><br />$79 special!!!!(plus cleaning and airbnb fee) all remaining nights this month! 3 night minimum. Ask for the monthly special.<br /><br />**Super Value on a Really Nice, Comfortable, Tastefully decorated, Clean private guest room, w/ full private bath available for your long or short term stay! Why stay in an overpriced hotel???!!<br /><br />**Excellent Boston location,  5 minute walk to the Orange Line Train, 4 Minute ride to Copley Plaza, the Center of all Boston attractions! Back Bay/South End, Downtown.<br /><br />**Located in a quiet Boston residential neighborhood, In a Historic Boston Victorian Rowhouse, Circa 1860. We offer the c",2020-08-31
96,4560053,*$129 SPECIAL* Historic Beauty! Minutes to Center!,128-2,8229,Terry,,,https://www.airbnb.com/rooms/4560053,https://www.airbnb.com/users/show/8229,3.0,Exemption: hospital contracts,?,,"Eclectic, Architecturally interesting, historic, diverse, and quiet neighborhood. Racially, ethnically, and economically diverse.","**Excellent Sunny** Fully equipped Private Duplex Apartment!  Less than 1 mile to Museums, Northeastern U and Hospitals. 2 miles to Copley sq center of the attractions. 1-2 miles to Fenway Park. Perfect Boston Home Base! Accommodates up to 8!<br /><br /><b>The space</b><br />** WELCOME *** FULL PRIVATE  Duplex APARTMENT In a Historic Victorian Brick Row House, Circa 1860.<br /><br />****SPECIAL****  All dates left THIS month $129 per night for up to 2 guests!!(Taxes, fees for cleaning and airbnb site fees  are additional and not included)  Except Holiday week. Hurry!<br /><br />**Marathon Week,  5 night minimum**  Rates are higher,  Please ask first if interested.<br /><br />Super value on a very nice, comfortable, tastefully decorated, clean, private 3 Bedroom Duplex Apartment with dining room, full kitchen and full 1.5 baths available for your long or short term stay!<br /><br />Excellent Boston location, 7-10 minute walk to the Orange Line Train, 5 Minute ride to the Center of all B",2020-08-31
