,id,name,cluster,host_id,host,host_alias,alias_id,listing_url,host_url,minimum_minimum_nights,license,ISD_status,ISD_address,neighborhood_overview,description,last_scraped
843,27634728,Boston Condominium,23-1,CorpGroup16,STARS,Kama,31340713.0,https://www.airbnb.com/rooms/27634728,https://www.airbnb.com/users/show/31340713,28.0,Missing,?,,"Quiet tree-lined street, steps to public transportation, Boston College and Boston University. Easy access to Boston and tourist attractions.","Bright, airy, sunny one bed found on first floor of Victorian home located  close to Saint Elizabeth Medical Center.  Private entrance and private porch. Features hwd floors, high ceilings,large living room with flat screen TV , sleeper sofa, work space and dining area. Bedroom offers queen bed and television. Fully equipped kitchen. Coin-op laundry, on sight parking. Pets considered.<br /><br /><b>The space</b><br />Bright and spacious one bedroom, sit outside and enjoy peace and relaxation on private porch with bistro table and chairs. some pets considered, additional cleaning fee applies. <br />$15 charge per night for parking.<br /><br /><b>Other things to note</b><br />After your reservation has been confirmed, we will email you a contract for you to review and sign. The contract will just outline the basic house rules.<br /><br />Pets are considered on a case by case basis. Please let us know if you will be bringing a pet. There is an additional $150 pet cleaning fee as the apart",2020-09-01
1164,35605277,"Renovated Chic 1 Bed, Sleeps 4, Steps to Transit",23-1,CorpGroup16,STARS,STARS Of,266312920.0,https://www.airbnb.com/rooms/35605277,https://www.airbnb.com/users/show/266312920,28.0,Missing,?,,"Great location, don't be fooled looking out over the quiet tree-lined street from the porch, this unit is just minutes to shops, restaurants, and public transportation (MBTA Green Line B, C & D trains) with easy access to Downtown Boston, Fenway Park, Boston College, Boston University, St. Elizabeth’s, Longwood Medical, and all of Boston’s tourist attractions.","Sun-filled, Chic 1 bedroom found on the high first floor, offers  charm with added modern day amenities such as central air, renovated kitchen and bath.<br /><br /><b>The space</b><br />High ceilings, french doors lead into bedroom, sleeper sofa in living area, ornate fireplace, stained glass, hwd floors, laundry in building, parking available for rent. Quiet tree-lined street , but minutes to public transportation. Easy access to hospitals, Boston tourist attractions.<br /><br /><b>Guest access</b><br />Entire unit, Laundry, Front Porch<br /><br /><b>Other things to note</b><br />After your reservation has been confirmed, we will email you a contract for you to review and sign. The contract will just outline the basic house rules.<br /><br />Pets are considered on a case by case basis. Please let us know if you will be bringing a pet. There is an additional $150 pet cleaning fee as the apartment has to go through a special cleaning after your stay. Guests bringing pets will be require",2020-09-01
1418,39707104,"Bright, Spacious 1 Bedroom Steps to MBTA",23-1,CorpGroup16,STARS,Kama,31340713.0,https://www.airbnb.com/rooms/39707104,https://www.airbnb.com/users/show/31340713,28.0,Missing,?,,"Quiet tree-lined street, steps to restaurants, cafes, shops and public transportation. Easy access to Boston, Tourist attractions,Longwood Medical, town centers and more.","Bright and spacious one bedroom found on the second floor of a Victorian home minutes to Saint Elizabeth Medical Center,  the B,C, and D Green Line MBTA. Open living area with living room and kitchen combo.  Coin operated laundry in the building, parking right next to the building for a fee. Pets considered.<br /><br /><b>The space</b><br />Decorative fireplace, flat screen TV, sleeper sofa and fully applianced kitchen with dining table for four. Bright bedroom with queen bed, double dresser and desk. Space offers ample closet space and beautiful hardwoord floors.<br /><br /><b>Other things to note</b><br />After your reservation has been confirmed, we will email you a contract for you to review and sign. The contract will just outline the basic house rules.<br /><br />Pets are considered on a case by case basis. Please let us know if you will be bringing a pet. There is an additional $150 pet cleaning fee as the apartment has to go through a special cleaning after your stay. Guests br",2020-09-01
1420,39732562,"Sunny, 1 bedroom,steps to public trans,parkg avail",23-1,CorpGroup16,STARS,STARS Of,266312920.0,https://www.airbnb.com/rooms/39732562,https://www.airbnb.com/users/show/266312920,28.0,Missing,?,,"Quiet tree-lined street, steps to restaurants, cafes, shops and public transportation. Easy access to Boston, Tourist attractions,Longwood Medical, town centers and more.","Bright and spacious one bedroom found on the second floor of a Victorian home located close to St Elizabeth Medical Center, minutes to the B,C, and D Green Line trains. Open living area with living room and kitchen combo. Coin operated laundry in the building, parking available in the lot right next to the apartment for $15/night (or monthly rates available). Pets considered.<br /><br /><b>The space</b><br />Decorative fireplace, flat screen TV, sleeper sofa and fully applianced kitchen with dining table for four. Bright bedroom with queen bed, double dresser and desk.<br /><br /><b>Other things to note</b><br />After your reservation has been confirmed, we will email you a contract for you to review and sign. The contract will just outline the basic house rules.<br /><br />Pets are considered on a case by case basis. Please let us know if you will be bringing a pet. There is an additional $150 pet cleaning fee as the apartment has to go through a special cleaning after your stay. Gues",2020-09-01
1475,40493715,"Sunny, Private, Furnished 1 Bed Condo with Porch",23-1,CorpGroup16,STARS,STARS Of,266312920.0,https://www.airbnb.com/rooms/40493715,https://www.airbnb.com/users/show/266312920,28.0,Missing,?,,"Quiet tree-lined street , but steps to restaurants,shops and 3 different green line trains. Easy commute to City, Boston College and Boston University.","Bright, airy, sunny one bed found on first floor of Victorian home located  close to Saint Elizabeth Medical Center. Private entrance and private porch. Features hwd floors, high ceilings,large living room with flat screen TV , sleeper sofa, work space and dining area. Bedroom offers queen bed and television. Fully equipped kitchen. Coin-op laundry, on sight parking. Pets considered.<br /><br /><b>The space</b><br />Bright and spacious one bedroom, sit outside and enjoy peace and relaxation on private porch with bistro table and chairs. some pets considered, additional cleaning fee applies. $15 charge per night for parking.<br /><br /><b>Guest access</b><br />Whole apartment and front porch.<br /><br /><b>Other things to note</b><br />After your reservation has been confirmed, we will email you a contract for you to review and sign. The contract will just outline the basic house rules.<br /><br />Pets are considered on a case by case basis. Please let us know if you will be bringing a ",2020-09-01
1476,40493790,"Furnished , Newly Renovated, Spacious Studio",23-1,CorpGroup16,STARS,STARS Of,266312920.0,https://www.airbnb.com/rooms/40493790,https://www.airbnb.com/users/show/266312920,31.0,Missing,?,,"Quiet tree-lined street, but steps to restaurants, shops and 3 different Green Line trains. Easy commute to downtown, Boston College, Boston University, Longwood Medical, and more.","Beautiful, modern, renovated studio found on the first floor of a Victorian Home. Features Central air, hardwood floors, high ceilings, spacious living area with flat screen smart TV, love seat. Fully applianced and equipped kitchen. Coin-op laundry, on site parking. Pets considered.<br /><br /><b>The space</b><br />Located  close to Saint Elizabeth Medical Center, on a quiet street, but minutes to public transportation, shops, cafes, restaurants and more. Newly renovated, central air, enjoy old world charm with modern day amenities. Easy commute to Boston, Longwood Medical area, Boston College, Boston University, and so much more.<br /><br /><b>Other things to note</b><br />After your reservation has been confirmed, we will email you a contract for you to review and sign. The contract will just outline the basic house rules.<br /><br />Pets are considered on a case by case basis. Please let us know if you will be bringing a pet. There is an additional $150 pet cleaning fee as the apar",2020-09-01
1485,40617998,"Modern, Newly Renovated 3Bed, 2Bath, Steps to MBTA",23-1,CorpGroup16,STARS,Kama,31340713.0,https://www.airbnb.com/rooms/40617998,https://www.airbnb.com/users/show/31340713,28.0,Missing,?,,"Located on a quiet street, but just minutes to public transportation MBTA Green Line B, C & D trains, shops, cafes, restaurants and more. Easy commute to downtown Boston, Longwood Medical area, Boston College, Boston University, St. Elizabeths and all of Bostons tourist attractions.","Stunning 3 bed 2 bath minutes to Green line trains, restaurants, cafes, and shopping . Easy access to Boston College, Boston University, and  Down town Boston. Brand new renovations feature gleaming hwd floors, high ceilings, gourmet kitchen with granite counter tops, breakfast bar and stainless steel appliances. In unit laundry.  All utilities are included. On-site parking available for rent.<br /><br /><b>The space</b><br />3 large bedrooms  feature beds, desks, and sitting area. Relax and enjoy your favorite show watching 65 inch flat screen tv . Two brand new bathrooms with glass shower doors. Unit comes fully furnished with fully equipped kitchen, linens and towels .<br /><br /><b>Guest access</b><br />Entire unit, front porch.<br /><br /><b>Other things to note</b><br />After your reservation has been confirmed, we will email you a contract for you to review and sign. The contract will just outline the basic house rules.<br /><br />Pets are considered on a case by case basis. Ple",2020-09-01
1486,40622067,"Cozy, Modern, Newly Renovated 3Bed, 2Bath",23-1,CorpGroup16,STARS,STARS Of,266312920.0,https://www.airbnb.com/rooms/40622067,https://www.airbnb.com/users/show/266312920,28.0,Missing,?,,"Located on a quiet street, but just minutes to public transportation MBTA Green Line B, C & D trains, shops, cafes, restaurants and more. Easy commute to downtown Boston, Longwood Medical area, Boston College, Boston University, St. Elizabeths and all of Bostons touristattractions.","Stunning 3 bed 2 bath minutes to Green line trains, restaurants, cafes, and shopping . Easy access to Boston College, Boston University, and  Down town Boston. Brand new renovations feature gleaming hwd floors, high ceilings, gourmet kitchen with granite counter tops, breakfast bar and stainless steel appliances. In unit laundry . All utilities are included. On-sight parking available for rent.<br /><br /><b>The space</b><br />3 large bedrooms  feature beds, desks, and sitting area. Relax and enjoy your favorite show watching 65 inch flat screen tv . Two brand new bathrooms with glass shower doors. Unit comes fully furnished with fully equipped kitchen, linens and towels.<br /><br /><b>Guest access</b><br />Entire Unit, Front porch<br /><br /><b>Other things to note</b><br />After your reservation has been confirmed, we will email you a contract for you to review and sign. The contract will just outline the basic house rules.<br /><br />Pets are considered on a case by case basis. Plea",2020-09-01
1755,43596487,"One Room Available in a 3Bed, 2Bath w/ Laundry",23-1,CorpGroup16,STARS,STARS Of,266312920.0,https://www.airbnb.com/rooms/43596487,https://www.airbnb.com/users/show/266312920,28.0,Missing,?,,"Located on a quiet street, but just minutes to public transportation MBTA Green Line B, C & D trains, shops, cafes, restaurants and more. Easy commute to downtown Boston, Longwood Medical area, Boston College, Boston University, St. Elizabeths and all of Bostons tourist attractions.","Private room available in a stunning 3bed 2bath shared apartment minutes to Green line trains, restaurants, cafes, and shopping. Easy access to St. Elizabeth's, Boston College, Boston University, and Down town Boston. Brand new renovations feature gleaming hwd floors, high ceilings, gourmet kitchen with granite counter tops, breakfast bar and stainless steel appliances. In unit laundry. All utilities are included. On-site parking available for rent.<br /><br /><b>Guest access</b><br />You will have the entire bedroom to yourself.  Common spaces (living room, kitchen and 2 bathrooms) are shared with 2 other tenants.<br /><br /><b>Other things to note</b><br />You will be sharing the common areas  (living room, kitchen and 2 bathrooms) with 2 other tenants. We will put you in touch prior to arrival. <br /><br />After your reservation has been confirmed, we will email you a contract for you to review and sign. The contract will just outline the basic house rules.<br /><br />On-site parkin",2020-09-01
