id,listing_url,name,host_id,host_url,host,neighbourhood,neighbourhood_cleansed,last_scraped,neighbourhood_group_cleansed,latitude,longitude,property_type,room_type,accommodates,bedrooms,beds,price,minimum_nights,maximum_nights,minimum_minimum_nights,has_availability,availability_30,availability_60,availability_90,availability_365,number_of_reviews,license,instant_bookable,host_alias,alias_id,status,ISD_status,ISD_address,ISD_category,license_listing_count,license_cat_max_exceed,simple_status,full_status,other_hosts,temp_class,cluster,centroid_group_distance,sub_centroid,sub_centroid_distance,color,high_confidence
24756613,https://www.airbnb.com/rooms/24756613,"PERFECT for SUMMER w/ AC, only 3 min WALK to train",156053359,https://www.airbnb.com/users/show/156053359,Ken,"Boston, Massachusetts, United States",Dorchester,2020-09-01,,42.29185,-71.06633000000002,Private room in condominium,Private room,4,1.0,2.0,45.0,91,1125,91.0,t,30,60,90,365,15,Missing,f,,,No license claimed,,,,,,No license claimed,No license claimed,,0.0,48-1,125.98775423357851,48-1-0,125.98775423357851,#FF9800,True
25025114,https://www.airbnb.com/rooms/25025114,Perfect for Summer with cool A/C LARGE 1200 sqft,156053359,https://www.airbnb.com/users/show/156053359,Ken,"Boston, Massachusetts, United States",Dorchester,2020-09-01,,42.29136,-71.06651,Private room in condominium,Private room,3,1.0,2.0,45.0,91,1125,91.0,t,30,60,90,90,9,Missing,t,,,No license claimed,,,,,,No license claimed,No license claimed,,0.0,48-1,59.16163808980985,48-1-0,59.16163808980985,#FF9800,True
25416313,https://www.airbnb.com/rooms/25416313,"Newly renovated, Best Location CENTER of Boston",156053359,https://www.airbnb.com/users/show/156053359,Ken,"Boston, Massachusetts, United States",Dorchester,2020-09-01,,42.29193,-71.06638000000002,Private room in condominium,Private room,3,1.0,2.0,45.0,91,1125,91.0,t,17,47,77,352,7,Missing,f,,,No license claimed,,,,,,No license claimed,No license claimed,,0.0,48-1,152.2585554518695,48-1-0,152.2585554518695,#FF9800,True
27074605,https://www.airbnb.com/rooms/27074605,COLLEGE STUDENTS are welcome 3 MINS walk to train,156053359,https://www.airbnb.com/users/show/156053359,Ken,"Boston, Massachusetts, United States",Dorchester,2020-08-31,,42.29107,-71.06636999999998,Private room in condominium,Private room,1,1.0,1.0,45.0,91,1125,91.0,t,0,0,0,58,3,Missing,t,,,No license claimed,,,,,,No license claimed,No license claimed,,0.0,48-1,163.43709784923328,48-1-0,163.43709784923328,#FF9800,True
28202522,https://www.airbnb.com/rooms/28202522,Walk to train Downtown or UMASS BOSTON,156053359,https://www.airbnb.com/users/show/156053359,Ken,"Boston, Massachusetts, United States",Dorchester,2020-08-31,,42.29174,-71.06644,Private room in condominium,Private room,1,1.0,1.0,45.0,91,1125,91.0,t,0,0,0,0,1,Missing,f,,,No license claimed,,,,,,No license claimed,No license claimed,,0.0,48-1,82.00841595442917,48-1-0,82.00841595442917,#FF9800,True
33682929,https://www.airbnb.com/rooms/33682929,Perfect for the Summer w/ cool A/C near Red Line,156053359,https://www.airbnb.com/users/show/156053359,Ken,"Boston, Massachusetts, United States",Dorchester,2020-09-01,,42.29114000000001,-71.06664,Private room in condominium,Private room,1,1.0,1.0,45.0,91,1125,91.0,t,0,0,0,228,2,Missing,f,,,No license claimed,,,,,,No license claimed,No license claimed,,0.0,48-1,146.49369638367222,48-1-0,146.49369638367222,#FF9800,True
