,id,name,cluster,host_id,host,host_alias,alias_id,listing_url,host_url,minimum_minimum_nights,license,ISD_status,ISD_address,neighborhood_overview,description,last_scraped
2,10730,Bright 1bed facing Golden Dome,73-1,CorpGroup41,Sassmorr,Anne,26988.0,https://www.airbnb.com/rooms/10730,https://www.airbnb.com/users/show/26988,91.0,Missing,?,,"Beacon Hill is located downtown and is conveniently located to multiple forms of transportation, shopping, restaurants, the State House and the Boston Common.","Bright, spacious unit, new galley kitchen, new Casper queen size bed, great closets, flat screen tv & wireless internet. The building features a doorman, common roofdeck & laundry each floor. Awesome location close to everything!<br /><br /><b>The space</b><br />Bright one bed facing the golden dome of the State House. Great closet space, sleeper sofa and new Casper queen bed. Rent includes high speed internet, basic cable, phone, furnishings, linens, kitchen and house wares. Laundry, trash and recycle on each floor.  The building has a concierge, elevator, amazing roof deck with views of the State House and the Boston Common.  Fantastic location close to transportation, shopping, restaurants, Government Center, the Financial District and the Theater District.<br /><br /><b>Guest access</b><br />Guests have access to everything in the unit.<br /><br /><b>Other things to note</b><br />Guests should expect to show government ID to the concierge when they arrive.  Move-in paperwork for th",2020-08-31
8,60356,Bookcase 1bd facing Boston Common,73-1,CorpGroup41,Sassmorr,Anne,26988.0,https://www.airbnb.com/rooms/60356,https://www.airbnb.com/users/show/26988,32.0,Missing,?,,,"Live beside the Boston Common and the State House in picturesque Beacon Hill!  This sunny 6th floor condo overlooks the Common and the State House, it has parquet wood floors, good closet space and ceiling fans. The building features a concierge, elevator, common roofdeck with amazing views, laundry and rubbish room on each floor. It is conveniently located close to transportation, shopping, restaurants, the Financial District, Government Center and the Theater District.<br /><br /><b>The space</b><br />Bright and sunny 1 bed facing the Boston Common and the State House.  Open kitchen/livingroom layout, large bedroom with queens size bed, good closet space, parquet wood floors, sleeper couch and high ceiling.  The rent includes utilities, basic cable, wifi, furniture, linens, kitchen and house wares. The elevator building features secure entry, doorman, laundry/garbage room on each floor, bike room and common roofdeck.  This is a fabulous location close to everything!  Minutes walk to ",2020-08-31
9,67774,Corner 1 bed facing Golden Dome,73-1,CorpGroup41,Sassmorr,Anne,26988.0,https://www.airbnb.com/rooms/67774,https://www.airbnb.com/users/show/26988,32.0,Missing,?,,"This building is located in the historic area known as Beacon Hill.  It is beside the State House and the Boston Common park.  Beacon Hill is a central location with multiple transportation options, shopping, restaurants, banks, etc.  The Theater District, the Financial District and Government Center are all within in a few blocks.","Live beside the State House and the Boston Common in picturesque Beacon Hill!  Sunny corner 1 bed facing the State House golden dome! Great location, close to everything, concierge building, elevators, common roofdeck, queen size bed, flat screen TV.<br /><br /><b>The space</b><br />Bright, one bed facing the Golden Dome of the State House! Concierge building located in Beacon Hill by the Boston  Common and convenient to shopping, transportation, restaurants and banking.  Easy walk to the Financial district and the Theater District.  The unit has contemporary furnishings, flat screen tv, DVD player, high speed internet, sleeper couch in livingroom, parquet wood floors, galley kitchen with fridge, electric cooktop, convection microwave and a queen sized bed.  The rent includes all utilities, linens, kitchen and house wares.<br /><br /><b>Guest access</b><br />The owners keep a few personal belongings in the closet on top shelf. Please do not disturb. Othewise, help yourself to any of th",2020-08-31
24,697078,Spacious 1 bed facing State House,73-1,CorpGroup41,Sassmorr,Anne,26988.0,https://www.airbnb.com/rooms/697078,https://www.airbnb.com/users/show/26988,91.0,Missing,?,,"Awesome location! Close to everything: transportation, shopping, restaurants, groceries, banking and the Boston Common","Spacious 1 bed facing the State House and the Boston Common. Bright, open layout with breakfast bar, queen size bed, great closet space and nice bathroom. Concierge building with elevator.<br /><br /><b>The space</b><br />Bright , spacious 1 bed with open living room/kitchen layout, parquet wood floors, view of the State House, breakfast bar, electric range, dishwasher, queen size bed, great closet space and updated bathroom.  Beacon Hill is conveniently located close to shopping, banking, restaurants, Wholefoods, the Park St Red T stop, the Green Government Center T stop and across the street from the Boston Common.<br /><br />The unit includes all utilities, linens, basic cable, internet, local phone, kitchen and house wares. Cable can be upgraded for an additional charge. <br /><br />The building has a doorman, 2 elevators, laundry and rubbish room on each floor and a common roofdeck with awesome views of Boston, the Common and the State House.  <br /><br />There is a $100 move-in f",2020-08-31
1193,36179054,"Sunny, upper floor facing the State House!",73-1,CorpGroup41,Sassmorr,Anne,26988.0,https://www.airbnb.com/rooms/36179054,https://www.airbnb.com/users/show/26988,32.0,Missing,?,,"Beacon Hill is a picturesque neighborhood filled with history, cobble stone streets and greenery.  It is conveniently located to transportation, shopping, banking, restaurants, the Financial District, Government Center and the Theater District.","Live beside the State House and the Boston Common in a concierge building!  This upper floor, sunny 1 bed features shiny parquet wood floors, queen size bed, flat screen TV in the living room and the bedroom, dining area, couch with foldout bed, walk-in-closet and a view of downtown.  The kitchen features granite counters, cooktop, micro-dishwasher and full size fridge. There is also a common roofdeck with amazing views of downtown, laundry and rubbish room on each floor and a concierge.<br /><br /><b>The space</b><br />There is a common roofdeck down hall and up the steps from this unit.  It has fabulous views of downtown and the perfect place to watch the sunset!  No pets, smoking or glass!<br /><br /><b>Other things to note</b><br />No smoking or pets are permitted in the unit or on the common roofdeck. This listing is subject to Boston Occupancy Taxes.  This collection process should begin July 1st and we are working with Airbnb and the city to finalize the details.",2020-08-31
